{
  "contentVersion": 1,
  "minClientVersion": "1.0.0",
  "updatedAt": "2026-10-20",
  "notice": null,
  "signs": [
    {
      "id": "aries",
      "name": "양자리",
      "dates": "3월 21일 ~ 4월 19일",
      "element": "fire",
      "trait": "앞장서는 용기와 시작하는 힘이 강한 별자리예요."
    },
    {
      "id": "taurus",
      "name": "황소자리",
      "dates": "4월 20일 ~ 5월 20일",
      "element": "earth",
      "trait": "차분하고 꾸준하며 감각이 섬세한 별자리예요."
    },
    {
      "id": "gemini",
      "name": "쌍둥이자리",
      "dates": "5월 21일 ~ 6월 21일",
      "element": "air",
      "trait": "호기심이 많고 말과 생각이 빠른 별자리예요."
    },
    {
      "id": "cancer",
      "name": "게자리",
      "dates": "6월 22일 ~ 7월 22일",
      "element": "water",
      "trait": "정이 많고 가까운 사람을 잘 챙기는 별자리예요."
    },
    {
      "id": "leo",
      "name": "사자자리",
      "dates": "7월 23일 ~ 8월 22일",
      "element": "fire",
      "trait": "밝고 당당하며 주변을 환하게 만드는 별자리예요."
    },
    {
      "id": "virgo",
      "name": "처녀자리",
      "dates": "8월 23일 ~ 9월 22일",
      "element": "earth",
      "trait": "꼼꼼하고 성실하며 정리를 잘하는 별자리예요."
    },
    {
      "id": "libra",
      "name": "천칭자리",
      "dates": "9월 23일 ~ 10월 22일",
      "element": "air",
      "trait": "균형을 중요하게 여기고 사람 사이를 잘 잇는 별자리예요."
    },
    {
      "id": "scorpio",
      "name": "전갈자리",
      "dates": "10월 23일 ~ 11월 21일",
      "element": "water",
      "trait": "집중력이 깊고 마음이 한결같은 별자리예요."
    },
    {
      "id": "sagittarius",
      "name": "사수자리",
      "dates": "11월 22일 ~ 12월 21일",
      "element": "fire",
      "trait": "자유롭고 낙천적이며 새로운 경험을 좋아하는 별자리예요."
    },
    {
      "id": "capricorn",
      "name": "염소자리",
      "dates": "12월 22일 ~ 1월 19일",
      "element": "earth",
      "trait": "책임감이 강하고 목표를 향해 꾸준히 오르는 별자리예요."
    },
    {
      "id": "aquarius",
      "name": "물병자리",
      "dates": "1월 20일 ~ 2월 18일",
      "element": "air",
      "trait": "독창적이고 친구를 소중히 여기는 별자리예요."
    },
    {
      "id": "pisces",
      "name": "물고기자리",
      "dates": "2월 19일 ~ 3월 20일",
      "element": "water",
      "trait": "상상력이 풍부하고 공감을 잘하는 별자리예요."
    }
  ],
  "houses": [
    {
      "n": 1,
      "name": "나",
      "theme": "나와 컨디션"
    },
    {
      "n": 2,
      "name": "돈",
      "theme": "돈과 소유"
    },
    {
      "n": 3,
      "name": "말",
      "theme": "말과 소통"
    },
    {
      "n": 4,
      "name": "집",
      "theme": "집과 가족"
    },
    {
      "n": 5,
      "name": "즐거움",
      "theme": "연애와 즐거움"
    },
    {
      "n": 6,
      "name": "일상",
      "theme": "일상과 습관"
    },
    {
      "n": 7,
      "name": "관계",
      "theme": "짝과 관계"
    },
    {
      "n": 8,
      "name": "깊은 마음",
      "theme": "나눔과 속마음"
    },
    {
      "n": 9,
      "name": "배움",
      "theme": "배움과 여행"
    },
    {
      "n": 10,
      "name": "일",
      "theme": "일과 평판"
    },
    {
      "n": 11,
      "name": "친구",
      "theme": "친구와 모임"
    },
    {
      "n": 12,
      "name": "쉼",
      "theme": "쉼과 정리"
    }
  ],
  "readings": {
    "1": {
      "total": {
        "enter": "새로운 기운이 나에게 모이는 날이에요. 미뤄 둔 일을 하나 시작해 보세요.",
        "stay": "내 페이스대로 움직일수록 일이 잘 풀려요. 하고 싶은 말은 솔직하게 해요.",
        "leave": "들뜬 기운이 가라앉는 날이에요. 오늘 한 일을 돌아보며 하루를 정리해요."
      },
      "love": {
        "enter": "표정과 말투가 한결 밝아 보여요. 먼저 안부를 건네기 좋은 날이에요.",
        "stay": "꾸미지 않은 모습이 매력으로 보여요. 편하게 마음을 표현해 보세요.",
        "leave": "상대의 반응을 너무 신경 쓰지 않아도 돼요. 내 마음부터 챙겨요."
      },
      "work": {
        "enter": "새 계획을 세우기 좋은 날이에요. 첫걸음을 작게 정해 보세요.",
        "stay": "혼자 집중하는 일에서 성과가 나요. 방해 요소를 잠시 꺼 두세요.",
        "leave": "벌여 둔 일 중 하나를 끝내는 데 힘을 쓰면 마음이 가벼워져요."
      },
      "money": {
        "enter": "나를 위한 작은 소비가 기분을 살려 줘요. 정해 둔 한도 안에서 즐겨요.",
        "stay": "충동구매보다 오래 쓸 물건에 눈이 가는 날이에요.",
        "leave": "이번 주 쓴 돈을 한 번 훑어보면 다음 계획이 선명해져요."
      }
    },
    "2": {
      "total": {
        "enter": "가진 것의 가치를 다시 보게 되는 날이에요. 소중한 것을 하나 챙겨요.",
        "stay": "차분하게 쌓아 가는 일이 잘 맞아요. 할 일을 순서대로 처리해요.",
        "leave": "필요 없는 것을 덜어 내면 마음까지 정리돼요."
      },
      "love": {
        "enter": "말보다 작은 선물이나 행동이 마음을 잘 전해 줘요.",
        "stay": "함께 맛있는 것을 먹으며 보내는 시간이 관계를 단단하게 해요.",
        "leave": "서운한 점이 있다면 부드럽게 꺼내 보세요. 쌓아 두지 않는 게 좋아요."
      },
      "work": {
        "enter": "내 능력을 보여 줄 기회가 와요. 해 온 일을 정리해 두세요.",
        "stay": "꾸준히 해 온 일이 인정받기 시작해요. 하던 방식을 지켜요.",
        "leave": "다음 할 일을 위해 자료와 도구를 정리해 두면 좋아요."
      },
      "money": {
        "enter": "지출 계획을 세우기 좋은 날이에요. 이번 달 꼭 필요한 곳부터 적어 보세요.",
        "stay": "작은 금액이라도 모으는 습관이 힘을 내는 날이에요.",
        "leave": "정기 결제나 구독을 한 번 점검해 보면 새는 돈이 보여요."
      }
    },
    "3": {
      "total": {
        "enter": "연락이 잦아지고 소식이 빨리 도는 날이에요. 답장을 미루지 마세요.",
        "stay": "가볍게 나눈 대화에서 좋은 아이디어가 나와요.",
        "leave": "말이 많아진 만큼 약속을 한 번 더 확인해요."
      },
      "love": {
        "enter": "짧은 메시지 하나가 분위기를 바꿔 줘요. 먼저 말을 걸어 보세요.",
        "stay": "웃음이 오가는 대화가 마음을 가깝게 해요.",
        "leave": "오해가 생겼다면 오늘 안에 짧게 풀어 두는 게 좋아요."
      },
      "work": {
        "enter": "회의나 통화에서 내 의견이 잘 전달돼요. 핵심부터 말해요.",
        "stay": "글로 정리해 두면 일이 훨씬 수월해져요.",
        "leave": "주고받은 내용을 메모로 남겨 두면 다음에 도움이 돼요."
      },
      "money": {
        "enter": "가까운 곳에서 쓰는 소소한 지출이 늘 수 있어요. 교통비와 간식비를 살펴요.",
        "stay": "비교해 보고 사면 같은 돈으로 더 만족할 수 있어요.",
        "leave": "빌려주거나 빌린 것이 있다면 오늘 정리해 두세요."
      }
    },
    "4": {
      "total": {
        "enter": "집과 가족에게 마음이 가는 날이에요. 편한 곳에서 기운을 채워요.",
        "stay": "익숙한 공간을 정돈하면 기분도 함께 맑아져요.",
        "leave": "집안일 하나를 마무리하면 내일이 가벼워져요."
      },
      "love": {
        "enter": "가족이나 가까운 사람과 보내는 시간이 큰 힘이 돼요.",
        "stay": "편안한 분위기에서 나눈 이야기가 오래 남아요.",
        "leave": "고마운 사람에게 짧게라도 마음을 전해 보세요."
      },
      "work": {
        "enter": "밖보다 안에서 차분히 준비하는 일이 잘 맞아요.",
        "stay": "기초를 다지는 일에 시간을 쓰면 나중에 빛을 봐요.",
        "leave": "급하지 않은 일은 내일로 미뤄도 괜찮아요."
      },
      "money": {
        "enter": "집에 필요한 물건을 챙기기 좋은 날이에요. 목록부터 적어요.",
        "stay": "생활비를 한 번 점검하면 아낄 곳이 보여요.",
        "leave": "충동적인 집 꾸미기 소비는 하루만 미뤄 보세요."
      }
    },
    "5": {
      "total": {
        "enter": "좋아하는 일을 하면 기운이 살아나는 날이에요. 나를 위한 시간을 내요.",
        "stay": "가볍게 즐기는 마음이 좋은 흐름을 불러요.",
        "leave": "재미있던 순간을 사진이나 메모로 남겨 보세요."
      },
      "love": {
        "enter": "설렘이 찾아오기 쉬운 날이에요. 새로운 만남에 마음을 열어 보세요.",
        "stay": "함께 웃을 거리를 만들면 관계가 한층 따뜻해져요.",
        "leave": "들뜬 마음을 조금 가라앉히면 상대가 더 잘 보여요."
      },
      "work": {
        "enter": "새 아이디어가 술술 떠올라요. 바로 적어 두세요.",
        "stay": "즐기면서 하는 일에서 좋은 결과가 나와요.",
        "leave": "벌여 놓은 아이디어 중 하나만 골라 다듬어 보세요."
      },
      "money": {
        "enter": "취미나 문화생활에 쓰는 돈이 기분 좋게 쓰이는 날이에요. 예산은 정해 두세요.",
        "stay": "작은 즐거움에 쓰는 돈은 아깝지 않아요. 다만 한도를 지켜요.",
        "leave": "이번 주 즐거움에 쓴 돈을 돌아보면 균형이 보여요."
      }
    },
    "6": {
      "total": {
        "enter": "생활 리듬을 바로잡기 좋은 날이에요. 작은 습관 하나를 정해요.",
        "stay": "해야 할 일을 하나씩 지워 가는 재미가 있는 날이에요.",
        "leave": "오늘 못 한 일은 내일 목록에 옮겨 두고 쉬어요."
      },
      "love": {
        "enter": "말보다 챙겨 주는 행동이 마음을 잘 전해요.",
        "stay": "소소한 도움을 주고받으며 사이가 가까워져요.",
        "leave": "피곤하면 약속을 무리하게 잡지 않아도 괜찮아요."
      },
      "work": {
        "enter": "밀린 일을 정리하기 좋은 날이에요. 쉬운 것부터 처리해요.",
        "stay": "꼼꼼함이 빛나는 날이에요. 마감 전에 한 번 더 확인해요.",
        "leave": "일하는 자리를 정리하면 내일 시작이 수월해져요."
      },
      "money": {
        "enter": "자주 쓰는 생활비를 기록해 보면 새는 곳이 보여요.",
        "stay": "필요한 것만 사는 날로 정해 보세요.",
        "leave": "영수증과 결제 내역을 정리해 두면 마음이 편해요."
      }
    },
    "7": {
      "total": {
        "enter": "사람과 함께할 때 일이 잘 풀리는 날이에요. 도움을 청해 보세요.",
        "stay": "상대의 입장을 한 번 더 들어 보면 해답이 보여요.",
        "leave": "관계에서 쌓인 일을 정리하기 좋은 날이에요."
      },
      "love": {
        "enter": "둘만의 시간을 갖기 좋은 날이에요. 먼저 약속을 잡아 보세요.",
        "stay": "서로의 다른 점이 오히려 매력으로 느껴져요.",
        "leave": "작은 다툼은 오늘 안에 웃으며 넘겨요."
      },
      "work": {
        "enter": "함께하자는 제안이 들어오기 쉬운 날이에요. 조건을 차분히 살펴요.",
        "stay": "역할을 나누면 일이 빨라져요.",
        "leave": "함께한 사람에게 고마움을 전하면 다음이 수월해요."
      },
      "money": {
        "enter": "함께 쓰는 돈은 미리 나눠 정하면 깔끔해요.",
        "stay": "더치페이나 정산은 그때그때 해 두세요.",
        "leave": "정산할 금액이 남아 있다면 오늘 마무리해요."
      }
    },
    "8": {
      "total": {
        "enter": "마음 깊은 곳의 생각이 떠오르는 날이에요. 혼자 정리할 시간을 가져요.",
        "stay": "겉보다 속을 보는 눈이 밝아지는 날이에요.",
        "leave": "오래 붙잡고 있던 고민 하나를 내려놓기 좋아요."
      },
      "love": {
        "enter": "진지한 대화가 관계를 한 단계 깊게 만들어요.",
        "stay": "믿음을 주는 작은 행동이 큰 의미가 돼요.",
        "leave": "지난 일에 대한 서운함은 흘려보내도 괜찮아요."
      },
      "work": {
        "enter": "숨은 문제를 찾아내는 눈이 좋아요. 자세히 살펴보세요.",
        "stay": "자료를 깊이 파고들수록 답이 보여요.",
        "leave": "끝난 일의 마무리 서류를 정리해 두세요."
      },
      "money": {
        "enter": "함께 쓰는 돈이나 나눠 내는 비용을 점검하기 좋은 날이에요.",
        "stay": "큰돈이 드는 결정은 하루 더 생각해 보세요.",
        "leave": "필요 없는 구독이나 자동 결제를 정리해 보세요."
      }
    },
    "9": {
      "total": {
        "enter": "새로운 것을 배우고 싶은 마음이 커지는 날이에요.",
        "stay": "낯선 곳이나 새로운 생각이 기분 전환이 돼요.",
        "leave": "배운 것을 한 줄로 정리해 두면 오래 남아요."
      },
      "love": {
        "enter": "함께 새로운 곳에 가 보면 설렘이 살아나요.",
        "stay": "생각이 통하는 대화가 마음을 끌어당겨요.",
        "leave": "서로의 생각이 달라도 존중하면 관계가 넓어져요."
      },
      "work": {
        "enter": "시야를 넓히는 공부나 자료 조사가 도움이 돼요.",
        "stay": "큰 그림을 먼저 그리면 세부 일이 쉬워져요.",
        "leave": "배운 내용을 일에 하나만 적용해 보세요."
      },
      "money": {
        "enter": "책이나 강의처럼 나를 키우는 데 쓰는 돈은 아깝지 않아요. 예산 안에서요.",
        "stay": "여행이나 나들이 계획은 비용부터 정리해 보세요.",
        "leave": "다음 배움을 위해 조금씩 따로 모아 두면 좋아요."
      }
    },
    "10": {
      "total": {
        "enter": "내가 한 일이 눈에 띄는 날이에요. 맡은 일을 똑 부러지게 처리해요.",
        "stay": "책임감이 믿음으로 돌아오는 날이에요.",
        "leave": "이번 주 해낸 일을 정리해 두면 다음 목표가 보여요."
      },
      "love": {
        "enter": "바쁜 와중에도 짧은 연락이 마음을 이어 줘요.",
        "stay": "일 이야기만 하기보다 서로의 하루를 물어보세요.",
        "leave": "바빴던 만큼 오늘 저녁은 함께 쉬는 시간을 만들어요."
      },
      "work": {
        "enter": "윗사람이나 고객에게 좋은 인상을 남기기 좋은 날이에요.",
        "stay": "목표를 분명히 하면 일의 속도가 붙어요.",
        "leave": "다음 단계 계획을 적어 두고 하루를 마무리해요."
      },
      "money": {
        "enter": "일에 꼭 필요한 도구라면 아끼지 않아도 괜찮아요. 꼭 필요한지만 따져요.",
        "stay": "일한 만큼의 보상을 차분히 정리해 보세요.",